{
  "pack_id": "atlas-fitness-wave-2-metrics-pack",
  "pack_version": "atlas.fitness.wave-2-metrics-pack.v1",
  "status": "owner_frozen_candidate",
  "lane": "wave_2_metrics",
  "owner_repo_id": "fitness",
  "doctrine_repo_ids": [
    "atlas"
  ],
  "consumer_repo_ids": [
    "playbook",
    "lifeline",
    "_stack"
  ],
  "frozen_fields": [
    "shared_nouns",
    "kpis",
    "funnel_definitions",
    "denominators",
    "correlation_keys",
    "dashboard_acceptance_checks"
  ],
  "evidence_refs": [
    "truth-pack/fitness/signals.json",
    "truth-pack/fitness/state-snapshots.json",
    "truth-pack/fitness/actions-and-receipts.json",
    "docs/architecture/fitness-integration.md",
    "docs/day-summary-taxonomy-glossary.md",
    "src/lib/ecosystem/fitness-integration-contract.ts",
    "src/lib/ecosystem/fitness-shadow-events.ts",
    "src/lib/session-follow-up-jobs.ts",
    "docs/ops/FITNESS-ATLAS-CONTRACT-ADOPTION.md",
    "docs/mobile-shell-contract.md"
  ],
  "shared_nouns": [
    {
      "noun": "member_id",
      "owner_repo_id": "fitness",
      "definition": "Stable member identity used as the primary actor join key across Fitness signals, snapshots, and inbound receipts.",
      "source_fields": [
        "signal.payload.memberId",
        "snapshot.snapshot.memberId",
        "receipt.memberId"
      ],
      "evidence_refs": [
        "src/lib/ecosystem/fitness-integration-contract.ts",
        "src/lib/ecosystem/fitness-shadow-events.ts"
      ]
    },
    {
      "noun": "session_id",
      "owner_repo_id": "fitness",
      "definition": "Stable workout session identifier for completion and miss outcomes.",
      "source_fields": [
        "signal.payload.sessionId"
      ],
      "evidence_refs": [
        "src/lib/ecosystem/fitness-integration-contract.ts",
        "src/lib/session-follow-up-jobs.ts",
        "src/app/today/page.tsx"
      ]
    },
    {
      "noun": "week_start_date",
      "owner_repo_id": "fitness",
      "definition": "ISO week window key used to roll weekly progress, goal, and plan-revision metrics onto the same grain.",
      "source_fields": [
        "signal.payload.weekStartDate",
        "snapshot.snapshot.weekStartDate",
        "receipt.payload.weekStartDate"
      ],
      "evidence_refs": [
        "src/lib/ecosystem/fitness-integration-contract.ts",
        "src/lib/ecosystem/fitness-integration-client.ts"
      ]
    },
    {
      "noun": "outbound_id",
      "owner_repo_id": "fitness",
      "definition": "Producer-side lineage key stamped on shadow-mode signals and snapshots before any downstream consumer acts on them.",
      "source_fields": [
        "signal.outboundId",
        "snapshot.outboundId"
      ],
      "evidence_refs": [
        "src/lib/ecosystem/fitness-integration-client.ts",
        "src/lib/ecosystem/fitness-shadow-events.ts"
      ]
    },
    {
      "noun": "source_outbound_id",
      "owner_repo_id": "fitness",
      "definition": "Receipt lineage key that points back to the originating outbound event for replay-safe joins.",
      "source_fields": [
        "receipt.sourceOutboundId"
      ],
      "evidence_refs": [
        "truth-pack/fitness/actions-and-receipts.json",
        "src/lib/ecosystem/fitness-integration-contract.ts",
        "src/lib/ecosystem/fitness-shadow-events.ts"
      ]
    },
    {
      "noun": "intent",
      "owner_repo_id": "atlas",
      "definition": "Atlas-owned semantic action vocabulary for surface meaning; future funnel entry surfaces may use intent labels without changing KPI math or denominator rules.",
      "source_fields": [
        "atlas.bottom_action_intent"
      ],
      "evidence_refs": [
        "docs/mobile-shell-contract.md"
      ]
    }
  ],
  "correlation_keys": [
    {
      "key": "member_id",
      "kind": "stable",
      "definition": "Primary actor join key across all current Atlas/Fitness metrics surfaces.",
      "source_fields": [
        "signal.payload.memberId",
        "snapshot.snapshot.memberId",
        "receipt.memberId"
      ],
      "required_for": [
        "all_kpis",
        "weekly_adherence_funnel",
        "recovery_guardrail_funnel"
      ],
      "evidence_refs": [
        "src/lib/ecosystem/fitness-integration-contract.ts",
        "src/lib/ecosystem/fitness-shadow-events.ts"
      ]
    },
    {
      "key": "session_id",
      "kind": "stable",
      "definition": "Workout outcome join key for session completion versus miss tracking.",
      "source_fields": [
        "signal.payload.sessionId"
      ],
      "required_for": [
        "workout_completion_rate"
      ],
      "evidence_refs": [
        "src/lib/ecosystem/fitness-integration-contract.ts",
        "src/app/today/page.tsx",
        "src/lib/session-follow-up-jobs.ts"
      ]
    },
    {
      "key": "week_start_date",
      "kind": "stable",
      "definition": "Weekly reporting grain for progress snapshots, goal hits, and weekly-plan receipts.",
      "source_fields": [
        "signal.payload.weekStartDate",
        "snapshot.snapshot.weekStartDate",
        "receipt.payload.weekStartDate"
      ],
      "required_for": [
        "weekly_goal_hit_rate",
        "weekly_adherence_funnel"
      ],
      "evidence_refs": [
        "src/lib/ecosystem/fitness-integration-contract.ts",
        "src/lib/ecosystem/fitness-integration-client.ts"
      ]
    },
    {
      "key": "observed_day",
      "kind": "derived",
      "definition": "UTC date derived from capturedAt, observedAt, or appliedAt for day-grain recovery and readiness rollups.",
      "source_fields": [
        "snapshot.snapshot.capturedAt",
        "signal.payload.observedAt",
        "receipt.appliedAt"
      ],
      "required_for": [
        "recovery_warning_rate",
        "recovery_guardrail_funnel"
      ],
      "evidence_refs": [
        "src/lib/ecosystem/fitness-integration-contract.ts",
        "src/lib/ecosystem/fitness-integration-client.ts"
      ]
    },
    {
      "key": "outbound_id",
      "kind": "stable",
      "definition": "Shadow-mode lineage key used to join warning signals to downstream receipts without counting raw duplicates.",
      "source_fields": [
        "signal.outboundId",
        "snapshot.outboundId"
      ],
      "required_for": [
        "recovery_guardrail_application_rate",
        "recovery_guardrail_funnel"
      ],
      "evidence_refs": [
        "src/lib/ecosystem/fitness-integration-client.ts",
        "src/lib/ecosystem/fitness-shadow-events.ts"
      ]
    },
    {
      "key": "source_outbound_id",
      "kind": "stable",
      "definition": "Receipt-side pointer back to the originating outbound event; this is the canonical cross-app join between Fitness shadow emissions and downstream receipts.",
      "source_fields": [
        "receipt.sourceOutboundId"
      ],
      "required_for": [
        "recovery_guardrail_application_rate",
        "recovery_guardrail_funnel"
      ],
      "evidence_refs": [
        "truth-pack/fitness/actions-and-receipts.json",
        "src/lib/ecosystem/fitness-shadow-events.ts"
      ]
    }
  ],
  "denominators": [
    {
      "denominator_id": "planned_weekly_member_window",
      "grain": "member_id + week_start_date",
      "definition": "Distinct member/week windows from weekly_progress_state where plannedWorkoutCount > 0.",
      "correlation_keys": [
        "member_id",
        "week_start_date"
      ],
      "evidence_refs": [
        "src/lib/ecosystem/fitness-integration-client.ts",
        "src/lib/ecosystem/fitness-integration-contract.ts"
      ]
    },
    {
      "denominator_id": "tracked_session_outcome_window",
      "grain": "member_id + session_id",
      "definition": "Distinct session outcome windows observed through workout_completed or workout_missed signals.",
      "correlation_keys": [
        "member_id",
        "session_id"
      ],
      "evidence_refs": [
        "src/lib/session-follow-up-jobs.ts",
        "src/app/today/page.tsx",
        "src/lib/ecosystem/fitness-integration-contract.ts"
      ]
    },
    {
      "denominator_id": "readiness_observation_window",
      "grain": "member_id + observed_day",
      "definition": "Distinct readiness observations derived from athlete_readiness_state snapshots at day grain.",
      "correlation_keys": [
        "member_id",
        "observed_day"
      ],
      "evidence_refs": [
        "src/lib/ecosystem/fitness-integration-client.ts",
        "src/lib/ecosystem/fitness-integration-contract.ts"
      ]
    },
    {
      "denominator_id": "recovery_warning_lineage_window",
      "grain": "member_id + outbound_id",
      "definition": "Distinct recovery_warning emissions counted at outbound lineage grain before receipt joins.",
      "correlation_keys": [
        "member_id",
        "outbound_id"
      ],
      "evidence_refs": [
        "src/lib/ecosystem/fitness-shadow-events.ts",
        "src/lib/ecosystem/fitness-integration-contract.ts"
      ]
    }
  ],
  "funnel_definitions": [
    {
      "funnel_id": "weekly_adherence_funnel",
      "label": "Weekly adherence",
      "entity_grain": "member_id + week_start_date",
      "stages": [
        {
          "stage_id": "weekly_progress_state_available",
          "event_kind": "snapshot",
          "event_type": "weekly_progress_state",
          "status": "contract_backed",
          "correlation_keys": [
            "member_id",
            "week_start_date"
          ],
          "denominator_id": "planned_weekly_member_window",
          "evidence_refs": [
            "src/lib/ecosystem/fitness-integration-contract.ts",
            "src/lib/ecosystem/fitness-integration-client.ts"
          ]
        },
        {
          "stage_id": "workout_completed",
          "event_kind": "signal",
          "event_type": "workout_completed",
          "status": "contract_backed",
          "correlation_keys": [
            "member_id",
            "session_id"
          ],